{
  "service_id": "cortex",
  "service_class": "file_intelligence",
  "state": "ready",
  "readiness_summary": {
    "readiness_class": "ready",
    "summary": "Cortex intake and extraction lanes are ready."
  },
  "operator_visible_message": "Cortex is ready.",
  "details_redacted": true,
  "last_updated_at": "2026-06-20T11:59:58Z"
}
